{
  "schema_version": "1.0",
  "candidate_id": "REPLACE_WITH_FROZEN_CANDIDATE_ID",
  "observed_at": "2027-01-04T15:00:00Z",
  "source_id": "REPLACE_WITH_REDACTED_SOURCE_ID",
  "currency": "USD",
  "commission_currency": "USD",
  "commission": null,
  "minimum_commission": null,
  "maximum_commission": null,
  "initial_margin_before": null,
  "initial_margin_change": null,
  "initial_margin_after": null,
  "maintenance_margin_before": null,
  "maintenance_margin_change": null,
  "maintenance_margin_after": null,
  "equity_with_loan_before": null,
  "equity_with_loan_change": null,
  "equity_with_loan_after": null,
  "broker_status": null,
  "warning_text": null,
  "account_scope_redacted": true,
  "example_only": true,
  "read_only": true,
  "transmit": false,
  "what_if": true,
  "order_capability": "forbidden"
}
